{
    "proposalId": "prop-001",
    "finalScore": 5,
    "gates": [
        {
            "name": "No Forbidden Actions",
            "passed": true,
            "details": "No restricted commands detected."
        },
        {
            "name": "Reversibility",
            "passed": true,
            "details": "Git is enabled; simple rollback possible."
        }
    ],
    "approvalRequired": true,
    "canAutoApply": false
}